{
  "meta": {
    "schema_version": "2.3",
    "unit": "dia_12",
    "subject": "dia",
    "profile": "dia",
    "subject_name": "Địa lí",
    "grade": 12,
    "generated_at": "2026-10-30",
    "counts": {
      "lessons": 35,
      "terms": 131,
      "terms_described": 122,
      "terms_out_of_source": 0,
      "open_notes": 0
    }
  },
  "source": {
    "book_type": "sgk",
    "series": "Kết nối tri thức với cuộc sống",
    "publisher": "NXB Giáo dục Việt Nam",
    "files": [
      {
        "file": "SGK ĐỊA LÝ 12-KNTT.pdf",
        "volume": null,
        "page_count": 181,
        "printed_offset": 2
      }
    ]
  },
  "toc": [
    {
      "id": "loi-noi-dau",
      "role": "front_matter",
      "kind": "loi_noi_dau",
      "label": null,
      "number": null,
      "title": "Lời nói đầu",
      "file": null,
      "source_file": "SGK ĐỊA LÝ 12-KNTT.pdf",
      "pdf_pages": [
        4,
        4
      ],
      "printed_pages": [
        2,
        2
      ],
      "status": "skip"
    },
    {
      "id": "muc-luc",
      "role": "front_matter",
      "kind": "muc_luc",
      "label": null,
      "number": null,
      "title": "Mục lục",
      "file": null,
      "source_file": "SGK ĐỊA LÝ 12-KNTT.pdf",
      "pdf_pages": [
        5,
        5
      ],
      "printed_pages": [
        3,
        3
      ],
      "status": "skip"
    },
    {
      "id": "huong-dan",
      "role": "front_matter",
      "kind": "huong_dan",
      "label": null,
      "number": null,
      "title": "Hướng dẫn sử dụng sách",
      "file": null,
      "source_file": "SGK ĐỊA LÝ 12-KNTT.pdf",
      "pdf_pages": [
        6,
        6
      ],
      "printed_pages": [
        4,
        4
      ],
      "status": "skip"
    },
    {
      "id": "p01",
      "role": "group",
      "kind": "phan",
      "label": "Phần 1",
      "number": 1,
      "title": "Địa lí tự nhiên",
      "children": [
        {
          "id": "b01",
          "role": "lesson",
          "kind": "bai",
          "label": "Bài 1",
          "number": 1,
          "title": "Vị trí địa lí và phạm vi lãnh thổ",
          "lesson_type": "ly_thuyet",
          "file": "Phan-01-Dia-li-tu-nhien/B01-Vi-tri-dia-li-va-pham-vi-lanh-tho.md",
          "source_file": "SGK ĐỊA LÝ 12-KNTT.pdf",
          "pdf_pages": [
            7,
            11
          ],
          "printed_pages": [
            5,
            9
          ],
          "status": "verified",
          "objectives": null,
          "key_terms": [],
          "figures": [
            {
              "id": "H12-dia-b01-01",
              "file": "Phan-01-Dia-li-tu-nhien/img/H12-dia-b01-01.png",
              "caption": "Hình 1.1. Bản đồ hành chính Việt Nam năm 2021",
              "pdf_page": 8
            },
            {
              "id": "H12-dia-b01-02",
              "file": "Phan-01-Dia-li-tu-nhien/img/H12-dia-b01-02.png",
              "caption": "Hình 1.2. Sơ đồ mặt cắt khái quát các vùng biển Việt Nam (theo Luật Biển Việt Nam 2012)",
              "pdf_page": 9
            }
          ]
        },
        {
          "id": "b02",
          "role": "lesson",
          "kind": "bai",
          "label": "Bài 2",
          "number": 2,
          "title": "Thiên nhiên nhiệt đới ẩm gió mùa",
          "lesson_type": "ly_thuyet",
          "file": "Phan-01-Dia-li-tu-nhien/B02-Thien-nhien-nhiet-doi-am-gio-mua.md",
          "source_file": "SGK ĐỊA LÝ 12-KNTT.pdf",
          "pdf_pages": [
            12,
            18
          ],
          "printed_pages": [
            10,
            16
          ],
          "status": "verified",
          "objectives": null,
          "key_terms": [],
          "figures": [
            {
              "id": "H12-dia-b02-01",
              "file": "Phan-01-Dia-li-tu-nhien/img/H12-dia-b02-01.png",
              "caption": "Hình 2.1. Gió mùa mùa đông ở Đông Nam Á",
              "pdf_page": 13
            },
            {
              "id": "H12-dia-b02-02",
              "file": "Phan-01-Dia-li-tu-nhien/img/H12-dia-b02-02.png",
              "caption": "Hình 2.2. Gió mùa mùa hạ ở Đông Nam Á",
              "pdf_page": 14
            },
            {
              "id": "H12-dia-b02-03",
              "file": "Phan-01-Dia-li-tu-nhien/img/H12-dia-b02-03.png",
              "caption": "Hình 2.3. Bản đồ khí hậu Việt Nam",
              "pdf_page": 15
            },
            {
              "id": "H12-dia-b02-04",
              "file": "Phan-01-Dia-li-tu-nhien/img/H12-dia-b02-04.png",
              "caption": "Hình 2.4. Địa hình các-xtơ ở Quảng Bình",
              "pdf_page": 16
            }
          ]
        },
        {
          "id": "b03",
          "role": "lesson",
          "kind": "bai",
          "label": "Bài 3",
          "number": 3,
          "title": "Sự phân hoá đa dạng của thiên nhiên",
          "lesson_type": "ly_thuyet",
          "file": "Phan-01-Dia-li-tu-nhien/B03-Su-phan-hoa-da-dang-cua-thien-nhien.md",
          "source_file": "SGK ĐỊA LÝ 12-KNTT.pdf",
          "pdf_pages": [
            19,
            28
          ],
          "printed_pages": [
            17,
            26
          ],
          "status": "verified",
          "objectives": null,
          "key_terms": [],
          "figures": [
            {
              "id": "H12-dia-b03-01",
              "file": "Phan-01-Dia-li-tu-nhien/img/H12-dia-b03-01.png",
              "caption": "Hình 3.1. Bản đồ địa lí tự nhiên Việt Nam",
              "pdf_page": 20
            },
            {
              "id": "H12-dia-b03-02",
              "file": "Phan-01-Dia-li-tu-nhien/img/H12-dia-b03-02.png",
              "caption": "Hình 3.2. Bản đồ tự nhiên miền Bắc và Đông Bắc Bắc Bộ",
              "pdf_page": 23
            },
            {
              "id": "H12-dia-b03-03",
              "file": "Phan-01-Dia-li-tu-nhien/img/H12-dia-b03-03.png",
              "caption": "Hình 3.3. Bản đồ tự nhiên miền Tây Bắc và Bắc Trung Bộ",
              "pdf_page": 25
            },
            {
              "id": "H12-dia-b03-04",
              "file": "Phan-01-Dia-li-tu-nhien/img/H12-dia-b03-04.png",
              "caption": "Hình 3.4. Bản đồ tự nhiên miền Nam Trung Bộ và Nam Bộ",
              "pdf_page": 27
            }
          ]
        },
        {
          "id": "b04",
          "role": "lesson",
          "kind": "bai",
          "label": "Bài 4",
          "number": 4,
          "title": "Thực hành: Viết báo cáo về sự phân hoá tự nhiên Việt Nam",
          "lesson_type": "thuc_hanh",
          "file": "Phan-01-Dia-li-tu-nhien/B04-Thuc-hanh-Viet-bao-cao-ve-su-phan-hoa-tu-nhien.md",
          "source_file": "SGK ĐỊA LÝ 12-KNTT.pdf",
          "pdf_pages": [
            29,
            29
          ],
          "printed_pages": [
            27,
            27
          ],
          "status": "verified",
          "objectives": null,
          "key_terms": [],
          "figures": []
        },
        {
          "id": "b05",
          "role": "lesson",
          "kind": "bai",
          "label": "Bài 5",
          "number": 5,
          "title": "Vấn đề sử dụng hợp lí tài nguyên thiên nhiên và bảo vệ môi trường",
          "lesson_type": "ly_thuyet",
          "file": "Phan-01-Dia-li-tu-nhien/B05-Van-de-su-dung-hop-li-tai-nguyen-thien-nhien-va.md",
          "source_file": "SGK ĐỊA LÝ 12-KNTT.pdf",
          "pdf_pages": [
            30,
            33
          ],
          "printed_pages": [
            28,
            31
          ],
          "status": "verified",
          "objectives": null,
          "key_terms": [],
          "figures": []
        }
      ]
    },
    {
      "id": "p02",
      "role": "group",
      "kind": "phan",
      "label": "Phần 2",
      "number": 2,
      "title": "Địa lí dân cư",
      "children": [
        {
          "id": "b06",
          "role": "lesson",
          "kind": "bai",
          "label": "Bài 6",
          "number": 6,
          "title": "Dân số Việt Nam",
          "lesson_type": "ly_thuyet",
          "file": "Phan-02-Dia-li-dan-cu/B06-Dan-so-Viet-Nam.md",
          "source_file": "SGK ĐỊA LÝ 12-KNTT.pdf",
          "pdf_pages": [
            34,
            38
          ],
          "printed_pages": [
            32,
            36
          ],
          "status": "verified",
          "objectives": null,
          "key_terms": [],
          "figures": [
            {
              "id": "H12-dia-b06-01",
              "file": "Phan-02-Dia-li-dan-cu/img/H12-dia-b06-01.png",
              "caption": "Hình 6.1. Số dân và tỉ lệ tăng dân số của nước ta giai đoạn 1979 – 2021",
              "pdf_page": 34
            },
            {
              "id": "H12-dia-b06-02",
              "file": "Phan-02-Dia-li-dan-cu/img/H12-dia-b06-02.png",
              "caption": "Hình 6.2. Tháp dân số Việt Nam năm 1979 và năm 2021",
              "pdf_page": 35
            },
            {
              "id": "H12-dia-b06-03",
              "file": "Phan-02-Dia-li-dan-cu/img/H12-dia-b06-03.png",
              "caption": "Hình 6.3. Bản đồ phân bố dân cư Việt Nam năm 2021",
              "pdf_page": 36
            }
          ]
        },
        {
          "id": "b07",
          "role": "lesson",
          "kind": "bai",
          "label": "Bài 7",
          "number": 7,
          "title": "Lao động và việc làm",
          "lesson_type": "ly_thuyet",
          "file": "Phan-02-Dia-li-dan-cu/B07-Lao-dong-va-viec-lam.md",
          "source_file": "SGK ĐỊA LÝ 12-KNTT.pdf",
          "pdf_pages": [
            39,
            42
          ],
          "printed_pages": [
            37,
            40
          ],
          "status": "verified",
          "objectives": null,
          "key_terms": [],
          "figures": [
            {
              "id": "H12-dia-b07-01",
              "file": "Phan-02-Dia-li-dan-cu/img/H12-dia-b07-01.png",